[
  {
    "id": "anu",
    "name": "Australian National University",
    "abbr": "ANU",
    "city": "Canberra",
    "state": "ACT",
    "lat": -35.2764,
    "lng": 149.1205,
    "group": "Go8",
    "tlUrl": "https://services.anu.edu.au/business-units/centre-for-learning-teaching",
    "traditionalCountry": "Ngunnawal and Ngambri"
  },
  {
    "id": "unimelb",
    "name": "University of Melbourne",
    "abbr": "UniMelb",
    "city": "Melbourne",
    "state": "VIC",
    "lat": -37.7964,
    "lng": 144.9611,
    "group": "Go8",
    "tlUrl": "https://melbourne-cshe.unimelb.edu.au/",
    "traditionalCountry": "Wurundjeri Woi-wurrung"
  },
  {
    "id": "unsw",
    "name": "UNSW Sydney",
    "abbr": "UNSW",
    "city": "Sydney",
    "state": "NSW",
    "lat": -33.9173,
    "lng": 151.2253,
    "group": "Go8",
    "tlUrl": "https://www.teaching.unsw.edu.au/",
    "traditionalCountry": "Bidjigal and Gadigal"
  },
  {
    "id": "usyd",
    "name": "University of Sydney",
    "abbr": "USyd",
    "city": "Sydney",
    "state": "NSW",
    "lat": -33.886,
    "lng": 151.1857,
    "group": "Go8",
    "tlUrl": "https://educational-innovation.sydney.edu.au/",
    "traditionalCountry": "Gadigal"
  },
  {
    "id": "uq",
    "name": "University of Queensland",
    "abbr": "UQ",
    "city": "Brisbane",
    "state": "QLD",
    "lat": -27.4963,
    "lng": 153.0125,
    "group": "Go8",
    "tlUrl": "https://teaching-learning.uq.edu.au/",
    "traditionalCountry": "Turrbal and Jagera"
  },
  {
    "id": "uwa",
    "name": "University of Western Australia",
    "abbr": "UWA",
    "city": "Perth",
    "state": "WA",
    "lat": -31.983,
    "lng": 115.8172,
    "group": "Go8",
    "tlUrl": "https://www.uwa.edu.au/staff/educational-enhancement-unit",
    "traditionalCountry": "Whadjuk Noongar"
  },
  {
    "id": "monash",
    "name": "Monash University",
    "abbr": "Monash",
    "city": "Melbourne",
    "state": "VIC",
    "lat": -37.9103,
    "lng": 145.1339,
    "group": "Go8",
    "tlUrl": "https://www.monash.edu/learning-teaching",
    "traditionalCountry": "Wurundjeri Woi-wurrung"
  },
  {
    "id": "adelaide",
    "name": "Adelaide University",
    "abbr": "Adelaide",
    "city": "Adelaide",
    "state": "SA",
    "lat": -34.928,
    "lng": 138.6007,
    "group": "Go8",
    "tlUrl": "https://www.adelaide.edu.au/learning/",
    "traditionalCountry": "Kaurna"
  },
  {
    "id": "rmit",
    "name": "RMIT University",
    "abbr": "RMIT",
    "city": "Melbourne",
    "state": "VIC",
    "lat": -37.8081,
    "lng": 144.9631,
    "group": "ATN",
    "tlUrl": "https://www.rmit.edu.au/staff/learning-teaching",
    "traditionalCountry": "Wurundjeri Woi-wurrung"
  },
  {
    "id": "uts",
    "name": "University of Technology Sydney",
    "abbr": "UTS",
    "city": "Sydney",
    "state": "NSW",
    "lat": -33.8833,
    "lng": 151.2,
    "group": "ATN",
    "tlUrl": "https://lx.uts.edu.au/",
    "traditionalCountry": "Gadigal"
  },
  {
    "id": "qut",
    "name": "Queensland University of Technology",
    "abbr": "QUT",
    "city": "Brisbane",
    "state": "QLD",
    "lat": -27.4785,
    "lng": 153.0288,
    "group": "ATN",
    "tlUrl": "https://www.qut.edu.au/about/learning-and-teaching",
    "traditionalCountry": "Turrbal and Jagera"
  },
  {
    "id": "curtin",
    "name": "Curtin University",
    "abbr": "Curtin",
    "city": "Perth",
    "state": "WA",
    "lat": -32.0034,
    "lng": 115.894,
    "group": "ATN",
    "tlUrl": "https://www.curtin.edu.au/about/learning-teaching/",
    "traditionalCountry": "Whadjuk Noongar"
  },
  {
    "id": "deakin",
    "name": "Deakin University",
    "abbr": "Deakin",
    "city": "Geelong",
    "state": "VIC",
    "lat": -38.1958,
    "lng": 144.3,
    "group": "ATN",
    "tlUrl": "https://www.deakin.edu.au/about-deakin/leadership-governance/learning-and-teaching",
    "traditionalCountry": "Wadawurrung"
  },
  {
    "id": "newcastle",
    "name": "University of Newcastle",
    "abbr": "Newcastle",
    "city": "Newcastle",
    "state": "NSW",
    "lat": -32.8912,
    "lng": 151.6925,
    "group": "ATN",
    "tlUrl": "https://www.newcastle.edu.au/about-uon/governance-and-leadership/learning-and-teaching",
    "traditionalCountry": "Awabakal and Worimi"
  },
  {
    "id": "flinders",
    "name": "Flinders University",
    "abbr": "Flinders",
    "city": "Adelaide",
    "state": "SA",
    "lat": -35.0175,
    "lng": 138.571,
    "group": "IRU",
    "tlUrl": "https://staff.flinders.edu.au/learning-teaching",
    "traditionalCountry": "Kaurna"
  },
  {
    "id": "griffith",
    "name": "Griffith University",
    "abbr": "Griffith",
    "city": "Brisbane",
    "state": "QLD",
    "lat": -27.556,
    "lng": 153.052,
    "group": "IRU",
    "tlUrl": "https://www.griffith.edu.au/learning-futures",
    "traditionalCountry": "Yuggera and Turrbal"
  },
  {
    "id": "jcu",
    "name": "James Cook University",
    "abbr": "JCU",
    "city": "Townsville",
    "state": "QLD",
    "lat": -19.3254,
    "lng": 146.758,
    "group": "IRU",
    "tlUrl": "https://www.jcu.edu.au/learning-and-teaching",
    "traditionalCountry": "Wulgurukaba and Bindal"
  },
  {
    "id": "latrobe",
    "name": "La Trobe University",
    "abbr": "La Trobe",
    "city": "Melbourne",
    "state": "VIC",
    "lat": -37.7162,
    "lng": 145.0497,
    "group": "IRU",
    "tlUrl": "https://www.latrobe.edu.au/staff/learning-and-teaching",
    "traditionalCountry": "Wurundjeri"
  },
  {
    "id": "murdoch",
    "name": "Murdoch University",
    "abbr": "Murdoch",
    "city": "Perth",
    "state": "WA",
    "lat": -32.07,
    "lng": 115.8379,
    "group": "IRU",
    "tlUrl": "https://www.murdoch.edu.au/Learning-and-Teaching/Learning-and-teaching-strategy/Our-university/",
    "traditionalCountry": "Whadjuk Noongar"
  },
  {
    "id": "wsu",
    "name": "Western Sydney University",
    "abbr": "WSU",
    "city": "Penrith",
    "state": "NSW",
    "lat": -33.754,
    "lng": 150.76,
    "group": "IRU",
    "tlUrl": "https://www.westernsydney.edu.au/learning-futures",
    "traditionalCountry": "Dharug"
  },
  {
    "id": "canberra",
    "name": "University of Canberra",
    "abbr": "UC",
    "city": "Canberra",
    "state": "ACT",
    "lat": -35.242,
    "lng": 149.0845,
    "group": "IRU",
    "tlUrl": "https://www.canberra.edu.au/about-uc/l-and-t",
    "traditionalCountry": "Ngunnawal and Ngambri"
  },
  {
    "id": "csu",
    "name": "Charles Sturt University",
    "abbr": "CSU",
    "city": "Wagga Wagga",
    "state": "NSW",
    "lat": -35.0656,
    "lng": 147.3543,
    "group": "RUN",
    "tlUrl": "https://www.csu.edu.au/division/learning-teaching",
    "traditionalCountry": "Wiradjuri"
  },
  {
    "id": "cqu",
    "name": "CQUniversity",
    "abbr": "CQU",
    "city": "Rockhampton",
    "state": "QLD",
    "lat": -23.32,
    "lng": 150.515,
    "group": "RUN",
    "tlUrl": "https://www.cqu.edu.au/about-us/excellence-education",
    "traditionalCountry": "Darumbal"
  },
  {
    "id": "federation",
    "name": "Federation University",
    "abbr": "FedUni",
    "city": "Ballarat",
    "state": "VIC",
    "lat": -37.5485,
    "lng": 143.856,
    "group": "RUN",
    "tlUrl": "https://federation.edu.au/staff/learning-and-teaching",
    "traditionalCountry": "Wadawurrung"
  },
  {
    "id": "scu",
    "name": "Southern Cross University",
    "abbr": "SCU",
    "city": "Lismore",
    "state": "NSW",
    "lat": -28.814,
    "lng": 153.3,
    "group": "RUN",
    "tlUrl": "https://www.scu.edu.au/staff/teaching-and-learning/",
    "traditionalCountry": "Widjabul Wia-bal (Bundjalung)"
  },
  {
    "id": "une",
    "name": "University of New England",
    "abbr": "UNE",
    "city": "Armidale",
    "state": "NSW",
    "lat": -30.486,
    "lng": 151.64,
    "group": "RUN",
    "tlUrl": "https://www.une.edu.au/cetl",
    "traditionalCountry": "Anaiwan"
  },
  {
    "id": "usq",
    "name": "University of Southern Queensland",
    "abbr": "UniSQ",
    "city": "Toowoomba",
    "state": "QLD",
    "lat": -27.559,
    "lng": 151.953,
    "group": "RUN",
    "tlUrl": "https://www.unisq.edu.au/about-unisq/about-us/learning-teaching",
    "traditionalCountry": "Giabal and Jarowair"
  },
  {
    "id": "usc",
    "name": "University of the Sunshine Coast",
    "abbr": "USC",
    "city": "Sippy Downs",
    "state": "QLD",
    "lat": -26.7175,
    "lng": 153.065,
    "group": "RUN",
    "tlUrl": "https://www.unisc.edu.au/about/learning-and-teaching-at-unisc/learning-and-teaching-support-centre-for-learning-and-teaching",
    "traditionalCountry": "Kabi Kabi (Gubbi Gubbi)"
  },
  {
    "id": "macquarie",
    "name": "Macquarie University",
    "abbr": "Macquarie",
    "city": "Sydney",
    "state": "NSW",
    "lat": -33.7738,
    "lng": 151.1126,
    "group": "Unaligned",
    "tlUrl": "https://staff.mq.edu.au/learning-and-teaching",
    "traditionalCountry": "Wallumattagal (Dharug)"
  },
  {
    "id": "uow",
    "name": "University of Wollongong",
    "abbr": "UOW",
    "city": "Wollongong",
    "state": "NSW",
    "lat": -34.405,
    "lng": 150.8785,
    "group": "Unaligned",
    "tlUrl": "https://www.uow.edu.au/about/learning-teaching/",
    "traditionalCountry": "Dharawal"
  },
  {
    "id": "swinburne",
    "name": "Swinburne University of Technology",
    "abbr": "Swinburne",
    "city": "Melbourne",
    "state": "VIC",
    "lat": -37.822,
    "lng": 145.039,
    "group": "Unaligned",
    "tlUrl": "https://www.swinburne.edu.au/about/strategy-initiatives/learning-teaching-at-swinburne/",
    "traditionalCountry": "Wurundjeri Woi-wurrung"
  },
  {
    "id": "vu",
    "name": "Victoria University",
    "abbr": "VU",
    "city": "Melbourne",
    "state": "VIC",
    "lat": -37.794,
    "lng": 144.8998,
    "group": "Unaligned",
    "tlUrl": "https://www.vu.edu.au/about-vu/news-events/news/vu-block-model",
    "traditionalCountry": "Wurundjeri and Bunurong"
  },
  {
    "id": "ecu",
    "name": "Edith Cowan University",
    "abbr": "ECU",
    "city": "Perth",